{
  "engine_version": "0.8.2",
  "findings": [],
  "page_id": "page-8619f3db280abbfd867eefe4",
  "result": "PASS",
  "schema_version": "1.0",
  "semantic_visual_review": {
    "reason": "semantic crop, iconography, action, culture, character consistency and image artifacts require genuine pixel review",
    "result": "ESCALATE"
  }
}
