{
  "engine_version": "0.8.0",
  "findings": [],
  "page_id": "dm04-renderer-fixture-page-01",
  "result": "PASS",
  "schema_version": "1.0",
  "semantic_visual_review": {
    "reason": "semantic crop, iconography, action, culture, character consistency and image artifacts require genuine pixel review",
    "result": "NOT_APPLICABLE_SYNTHETIC_FIXTURE"
  }
}
