{
  "engine_version": "0.8.1",
  "findings": [],
  "page_id": "page-27d143ae995bf60742b65c5b",
  "result": "PASS",
  "schema_version": "1.0",
  "semantic_visual_review": {
    "reason": "semantic crop, iconography, action, culture, character consistency and image artifacts require genuine pixel review",
    "result": "ESCALATE"
  }
}
